{
  "protocolVersion": "0.1",
  "task": {
    "id": "task_example_notion_task_update",
    "type": "notion.task.update",
    "createdAt": "2026-06-12T00:00:00Z",
    "deadlineAt": null
  },
  "run": {
    "id": "run_example_notion_task_update",
    "attempt": 1,
    "correlationId": "corr_example_notion_task_update"
  },
  "actor": {
    "requestedBy": "developer",
    "agent": "notion-writer"
  },
  "input": {
    "page": {
      "pageId": "1a2b3c4d5e6f7a8b9c0d1e2f3a4b5c6d"
    },
    "status": "Done",
    "summary": {
      "text": "Workflow completed successfully.",
      "prUrl": "https://github.com/AnchorageLabs/envy/pull/12",
      "commitSha": "8c6562e89957338174725af26c6591f50595450b",
      "testReportUri": "file:///tmp/anchorage-agent-artifacts/run_example/test-report.json",
      "ciReportUri": "file:///tmp/anchorage-agent-artifacts/run_example/ci-report.json",
      "artifacts": ["file:///tmp/anchorage-agent-artifacts/run_example/merge-completed.json"]
    }
  },
  "capabilities": ["notion.write"],
  "policy": {
    "maxDurationSeconds": 120
  },
  "context": {
    "parentTaskId": "task_example_merge_prepare",
    "priorArtifacts": []
  }
}
