{
  "protocolVersion": "0.1",
  "task": {
    "id": "task_integration_review_run",
    "type": "review.run",
    "createdAt": "2026-05-09T00:00:00Z",
    "deadlineAt": null
  },
  "run": { "id": "run_integration_chain", "attempt": 1, "correlationId": "corr_integration" },
  "actor": { "requestedBy": "developer", "agent": "reviewer" },
  "repository": { "provider": "github", "owner": "AnchorageLabs", "name": "envy", "defaultBranch": "main" },
  "input": {},
  "capabilities": ["github.read", "github.write", "llm.review"],
  "policy": { "maxDurationSeconds": 900 },
  "context": {
    "parentTaskId": "task_integration_pr_open",
    "priorArtifacts": [
      { "artifactType": "pr.opened", "uri": "file:///tmp/integration/pr-opened.json", "mediaType": "application/json" }
    ]
  }
}
