{
  "protocolVersion": "0.1",
  "task": {
    "id": "task_demo_001",
    "type": "code.change",
    "createdAt": "2026-04-28T14:00:00Z",
    "deadlineAt": null
  },
  "run": {
    "id": "run_demo_001",
    "attempt": 1,
    "correlationId": "corr_demo_001"
  },
  "actor": {
    "requestedBy": "orchestrator",
    "agent": "minimal-agent"
  },
  "input": {
    "instruction": "Apply the requested code change"
  },
  "capabilities": ["workspace.read", "workspace.write"],
  "policy": {
    "maxDurationSeconds": 300
  },
  "context": {
    "parentTaskId": null,
    "priorArtifacts": []
  },
  "secrets": {
    "GITHUB_TOKEN": {
      "$ref": "secret://github-app-token"
    }
  }
}
