{
  "protocolVersion": "0.1",
  "task": {
    "id": "task_example_issue_read",
    "type": "issue.read",
    "createdAt": "2026-05-06T00:00:00Z",
    "deadlineAt": null
  },
  "run": {
    "id": "run_example_issue_read",
    "attempt": 1,
    "correlationId": "corr_example_issue_read"
  },
  "actor": {
    "requestedBy": "developer",
    "agent": "issue-reader"
  },
  "repository": {
    "provider": "github",
    "owner": "AnchorageLabs",
    "name": "anchorage",
    "defaultBranch": "main"
  },
  "input": {
    "issueNumber": 1
  },
  "capabilities": ["github.read"],
  "policy": {
    "maxDurationSeconds": 120
  },
  "context": {
    "parentTaskId": null,
    "priorArtifacts": []
  }
}
